{
  "version": 1,
  "research": {
    "label": "json-tools",
    "market": "US",
    "googleHl": "en",
    "googleGl": "us",
    "input": {"type": "seeds", "path": "input/json-tools.csv"}
  },
  "workflow": {"target": "finalization"},
  "discovery": {"expand": true, "requireAhrefs": false},
  "enrichment": {"modules": ["clusters", "query_suggestions", "domain_age", "pages", "site_structure"]},
  "finalization": {
    "historyPolicy": {"youngDomainMaxAgeDays": 730, "recentWebPresenceMaxAgeDays": 1095, "repurposeGapMinDays": 365},
    "historicalPresence": {"collectionMode": "annual", "maxCollections": 24, "domainCap": 30}
  }
}
